subjectName,subjectId,year,groupName,spCode,spDescription,sortOrder,isActive
BAHASA KADAZANDUSUN,BKD,5,5.0 Kabaalan Puralan Boros,5.1.2,"Kaanu popouni tuni i kikonsonan b / om / d /,/ ’ /, / b / om / d / soira' popolombus do boros",5010200,True
BAHASA KADAZANDUSUN,BKD,5,5.0 Kabaalan Puralan Boros,5.1.3,Kaanu popouni boros kivokal tanaru om toniba' id lisan.,5010300,True
BAHASA KADAZANDUSUN,BKD,5,5.0 Kabaalan Puralan Boros,5.2.1,Kaanu momoguno do sigot id ponuatan.,5020100,True
BAHASA KADAZANDUSUN,BKD,5,5.0 Kabaalan Puralan Boros,5.2.2,"Kaanu momoguno boros i kikonsonan / b / om / d /, / ‘ /,/ b / om / d / id ponuatan.",5020200,True
BAHASA KADAZANDUSUN,BKD,5,5.0 Kabaalan Puralan Boros,5.2.3,Kaanu momoguno boros kivokal tanaru om toniba' id ponuatan.,5020300,True
BAHASA KADAZANDUSUN,BKD,5,5.0 Kabaalan Puralan Boros,5.3.1,Kaanu momoguno do Boros Ngaran id ayat.,5030100,True
BAHASA KADAZANDUSUN,BKD,5,5.0 Kabaalan Puralan Boros,5.3.3,Kaanu momoguno do Boros Maan id ayat.,5030300,True
BAHASA KADAZANDUSUN,BKD,5,5.0 Kabaalan Puralan Boros,5.3.4,Kaanu momoguno do Boros Ula id ayat.,5030400,True
BAHASA KADAZANDUSUN,BKD,5,5.0 Kabaalan Puralan Boros,5.3.5,Kaanu momoguno do Boros Toguangon id ayat.,5030500,True
BAHASA KADAZANDUSUN,BKD,5,5.0 Kabaalan Puralan Boros,5.4.1,Kaanu momonsoi boros mintootoiso.,5040100,True
BAHASA KADAZANDUSUN,BKD,5,5.0 Kabaalan Puralan Boros,5.4.2,Kaanu momonsoi boros nosugku.,5040200,True
BAHASA KADAZANDUSUN,BKD,5,5.0 Kabaalan Puralan Boros,5.4.3,Kaanu momonsoi boros misompuru.,5040300,True
BAHASA KADAZANDUSUN,BKD,5,5.0 Kabaalan Puralan Boros,5.4.4,Kaanu momoguno boros misaup id lisan.,5040400,True
BAHASA KADAZANDUSUN,BKD,5,5.0 Kabaalan Puralan Boros,5.4.5,Kaanu momoguno pananda wacana,5040500,True
BAHASA KADAZANDUSUN,BKD,5,5.0 Kabaalan Puralan Boros,5.4.6,Kaanu momoguno patikol,5040600,True
BAHASA KADAZANDUSUN,BKD,5,5.0 Kabaalan Puralan Boros,5.4.7,Kaanu momoguno tanda' basa'.,5040700,True
BAHASA KADAZANDUSUN,BKD,5,5.0 Kabaalan Puralan Boros,5.5.1,Kaanu momonsoi ayat mintootoiso di agramatis.,5050100,True
BAHASA KADAZANDUSUN,BKD,5,5.0 Kabaalan Puralan Boros,5.5.2,Kaanu momonsoi ayat misompuru di agramatis.,5050200,True
BAHASA KADAZANDUSUN,BKD,5,5.0 Kabaalan Puralan Boros,5.6.1,Kaanu momoguno Kopomoroitan Ginumu' id lisan om ponuatan.,5060100,True
BAHASA KADAZANDUSUN,BKD,5,5.0 Kabaalan Puralan Boros,5.7.1,Kaanu momonsoi ayat toniba' momoguno do tukadan.,5070100,True
BAHASA KADAZANDUSUN,BKD,6,1.0 Kabaalan Mokinongou Om Moboros,1.1.1,Mokinongou tuni pimato noolos id isoiso' boros.,1010100,True
BAHASA KADAZANDUSUN,BKD,6,1.0 Kabaalan Mokinongou Om Moboros,1.1.2,Mongintutun pomoroitan pimato montok boros noolos.,1010200,True
BAHASA KADAZANDUSUN,BKD,6,1.0 Kabaalan Mokinongou Om Moboros,1.2.1,Moninduhai pomoroitan boros mantad bahan pongunsub.,1020100,True
BAHASA KADAZANDUSUN,BKD,6,1.0 Kabaalan Mokinongou Om Moboros,1.2.2,"Mamarait mogikaakawo boros miampai momoguno kopomoroitan, otus om loyuk di kotunud.",1020200,True
BAHASA KADAZANDUSUN,BKD,6,1.0 Kabaalan Mokinongou Om Moboros,1.2.3,Mongintutun boros ponuduk do kakadayan id teks audio.,1020300,True
BAHASA KADAZANDUSUN,BKD,6,1.0 Kabaalan Mokinongou Om Moboros,1.2.4,Mongintutun boros ponuduk do pogun id teks audio.,1020400,True
BAHASA KADAZANDUSUN,BKD,6,1.0 Kabaalan Mokinongou Om Moboros,1.3.1,Mokinongou montok mogihum koilaaan gama om waya' id teks audio.,1030100,True
BAHASA KADAZANDUSUN,BKD,6,1.0 Kabaalan Mokinongou Om Moboros,1.3.2,Mokinongou montok mongintutun idea toponsol om idea ponokodung id teks audio.,1030200,True
BAHASA KADAZANDUSUN,BKD,6,1.0 Kabaalan Mokinongou Om Moboros,1.3.3,Mokinongou montok monimbagos teks.,1030300,True
BAHASA KADAZANDUSUN,BKD,6,1.0 Kabaalan Mokinongou Om Moboros,1.3.4,Mokinongou montok mangarati' topurimanan,1030400,True
BAHASA KADAZANDUSUN,BKD,6,1.0 Kabaalan Mokinongou Om Moboros,1.4.1,Poposogu' idea suai mantad teks toi ko’ koilaan di norongou.,1040100,True
BAHASA KADAZANDUSUN,BKD,6,1.0 Kabaalan Mokinongou Om Moboros,1.4.2,Papadalin koilaan di norongou id teks linear.,1040200,True
BAHASA KADAZANDUSUN,BKD,6,1.0 Kabaalan Mokinongou Om Moboros,1.4.3,Manahak taksiran kumaa bahan pongunsub di pinokito.,1040300,True
BAHASA KADAZANDUSUN,BKD,6,1.0 Kabaalan Mokinongou Om Moboros,1.4.4,Manahak sogu' kumaa bahan pongunsub di pinokito,1040400,True
BAHASA KADAZANDUSUN,BKD,6,1.0 Kabaalan Mokinongou Om Moboros,1.5.1,Manahak pomusarahan miampai kotumbayaan sondii' tumanud uhu di pinatahak.,1050100,True
BAHASA KADAZANDUSUN,BKD,6,1.0 Kabaalan Mokinongou Om Moboros,1.5.2,Popolombus pibarasan montok mogikaakawo kohuboyoon.,1050200,True
BAHASA KADAZANDUSUN,BKD,6,1.0 Kabaalan Mokinongou Om Moboros,1.5.3,Mogibooboros kokomoi isoiso' uhu kanaanangan id kinaantakan formal.,1050300,True
BAHASA KADAZANDUSUN,BKD,6,2.0 Kabaalan Mambasa',2.1.1,Monginomot pamansayan montok mogikaakawo boros noolos.,2010100,True
BAHASA KADAZANDUSUN,BKD,6,2.0 Kabaalan Mambasa',2.1.2,Monoinu' ija'an om kopolombusan do boro,2010200,True
BAHASA KADAZANDUSUN,BKD,6,2.0 Kabaalan Mambasa',2.2.1,Mambasa' om monompipi' boros ponuduk do kakadayan id teks pambasaan.,2020100,True
BAHASA KADAZANDUSUN,BKD,6,2.0 Kabaalan Mambasa',2.2.2,Mambasa' om monompipi' boros ponuduk do pogun id teks pambasaan.,2020200,True
BAHASA KADAZANDUSUN,BKD,6,2.0 Kabaalan Mambasa',2.2.3,Monindu' komoyon boros tumanud bahan pogunsub.,2020300,True
BAHASA KADAZANDUSUN,BKD,6,2.0 Kabaalan Mambasa',2.3.1,Mambasa' om mamarati gama' om waya' id teks linear om okon linear.,2030100,True
BAHASA KADAZANDUSUN,BKD,6,2.0 Kabaalan Mambasa',2.3.2,Mambasa' om mamarati' koilaan poinlisok id isoiso' teks.,2030200,True
BAHASA KADAZANDUSUN,BKD,6,2.0 Kabaalan Mambasa',2.3.3,Mambasa' montok mogihum koilaan toponsol id teks pambasaan.,2030300,True
BAHASA KADAZANDUSUN,BKD,6,2.0 Kabaalan Mambasa',2.3.4,Mongulud koilaan di nabasa'.,2030400,True
BAHASA KADAZANDUSUN,BKD,6,2.0 Kabaalan Mambasa',2.3.5,Monimbagos teks pambasaan.,2030500,True
BAHASA KADAZANDUSUN,BKD,6,2.0 Kabaalan Mambasa',2.4.1,Poposunud gama' om waya' mantad teks.,2040100,True
BAHASA KADAZANDUSUN,BKD,6,2.0 Kabaalan Mambasa',2.4.2,Poposunud koilaan poinlisok mantad teks toi ko' bahan pongunsub.,2040200,True
BAHASA KADAZANDUSUN,BKD,6,2.0 Kabaalan Mambasa',2.4.3,Poposunud koilaan toponsol mantad teks toi ko' bahan pongunsub.,2040300,True
BAHASA KADAZANDUSUN,BKD,6,2.0 Kabaalan Mambasa',2.4.4,Poposunud ponolibamban isoiso' isu id teks pambasaan.,2040400,True
BAHASA KADAZANDUSUN,BKD,6,3.0 Kabaalan Monuat,3.1.1,Monuat mogikaakawo boros noolos.,3010100,True
BAHASA KADAZANDUSUN,BKD,6,3.0 Kabaalan Monuat,3.1.2,Monuat boros kipimato noolos.,3010200,True
BAHASA KADAZANDUSUN,BKD,6,3.0 Kabaalan Monuat,3.1.3,Monuat boros tumanud bahan pongunsub di pinatahak.,3010300,True
BAHASA KADAZANDUSUN,BKD,6,3.0 Kabaalan Monuat,3.2.1,Momonsoi mogikaakawo ayat kinuludan MSAkO.,3020100,True
BAHASA KADAZANDUSUN,BKD,6,3.0 Kabaalan Monuat,3.2.2,Momonsoi mogikaakawo ayat montok popolombus pamagatangan.,3020200,True
BAHASA KADAZANDUSUN,BKD,6,3.0 Kabaalan Monuat,3.2.3,Momonsoi mogikaakawo ayat montok popolombus do lisi do wokon.,3020300,True
BAHASA KADAZANDUSUN,BKD,6,3.0 Kabaalan Monuat,3.2.4,Momonsoi mogikaakawo ayat montok manahak pongunsuban,3020400,True
BAHASA KADAZANDUSUN,BKD,6,3.0 Kabaalan Monuat,3.3.1,Monuat teks linear om okon linear.,3030100,True
BAHASA KADAZANDUSUN,BKD,6,3.0 Kabaalan Monuat,3.3.2,Monuat susuyan.,3030200,True
BAHASA KADAZANDUSUN,BKD,6,3.0 Kabaalan Monuat,3.3.3,Monuat surat formal.,3030300,True
BAHASA KADAZANDUSUN,BKD,6,3.0 Kabaalan Monuat,3.3.4,Monuat panahangan.,3030400,True
BAHASA KADAZANDUSUN,BKD,6,3.0 Kabaalan Monuat,3.3.5,Monuat mogikaakawo ponuhuan.,3030500,True
BAHASA KADAZANDUSUN,BKD,6,4.0 Aspek Kolumison Boros,4.1.1,Mokinongou om popolombus mogikaakawo sinding.,4010100,True
BAHASA KADAZANDUSUN,BKD,6,4.0 Aspek Kolumison Boros,4.1.2,Mongintutun kotumbayaan sandad do tinaru.,4010200,True
BAHASA KADAZANDUSUN,BKD,6,4.0 Aspek Kolumison Boros,4.1.3,Mongintutun koubasanan sandad tinaru.,4010300,True
BAHASA KADAZANDUSUN,BKD,6,4.0 Aspek Kolumison Boros,4.2.1,Mokinongou mogikaakawo hiis,4020100,True
BAHASA KADAZANDUSUN,BKD,6,4.0 Aspek Kolumison Boros,4.2.2,Popolombus mogikaakawo hiis,4020200,True
BAHASA KADAZANDUSUN,BKD,6,4.0 Aspek Kolumison Boros,4.2.3,Mongintutun kawo hiis.,4020300,True
BAHASA KADAZANDUSUN,BKD,6,4.0 Aspek Kolumison Boros,4.2.4,Mokinongou om monginonong sorita' tinaru,4020400,True
BAHASA KADAZANDUSUN,BKD,6,4.0 Aspek Kolumison Boros,4.2.5,Popolombus mogikaakawo sorita' tinaru,4020500,True
BAHASA KADAZANDUSUN,BKD,6,4.0 Aspek Kolumison Boros,4.2.6,Popoboros ponontudukan id sorita' tinaru'.,4020600,True
BAHASA KADAZANDUSUN,BKD,6,4.0 Aspek Kolumison Boros,4.3.1,Papapanau ponurubungan montok mongintutun toilaan sandad tinaru kokomoi pogumoligan posorili'.,4030100,True
BAHASA KADAZANDUSUN,BKD,6,4.0 Aspek Kolumison Boros,4.3.2,Mogibooboros montok popionit koilaan di notimung mantad ponurubungan.,4030200,True
BAHASA KADAZANDUSUN,BKD,6,4.0 Aspek Kolumison Boros,4.4.1,Monoriuk koilaan kokomoi padsakayan sandad.,4040100,True
BAHASA KADAZANDUSUN,BKD,6,4.0 Aspek Kolumison Boros,4.4.2,Momolabel padsakayan sandad.,4040200,True
BAHASA KADAZANDUSUN,BKD,6,4.0 Aspek Kolumison Boros,4.4.3,Momonsoi replika padsakayan sandad,4040300,True
BAHASA KADAZANDUSUN,BKD,6,5.0 Aspek Puralan Boros,5.1.1,Momoguno pimato di kotunud id ponuatan.,5010100,True
BAHASA KADAZANDUSUN,BKD,6,5.0 Aspek Puralan Boros,5.1.2,Momoguno boros di kipimato / ' / id lisan om ponuatan.,5010200,True
BAHASA KADAZANDUSUN,BKD,6,5.0 Aspek Puralan Boros,5.1.3,Momoguno boros di kikonsonan /b/ om /d/ id lisan om ponuatan.,5010300,True
BAHASA KADAZANDUSUN,BKD,6,5.0 Aspek Puralan Boros,5.2.1,Momoguno do Boros Ngaran id ayat.,5020100,True
BAHASA KADAZANDUSUN,BKD,6,5.0 Aspek Puralan Boros,5.2.2,Momoguno do Boros Maan id ayat.,5020200,True
BAHASA KADAZANDUSUN,BKD,6,5.0 Aspek Puralan Boros,5.2.3,Momoguno do Boros Ula id ayat.,5020300,True
BAHASA KADAZANDUSUN,BKD,6,5.0 Aspek Puralan Boros,5.3.1,Mongintutun om momoguno boros ponokodung id ayat.,5030100,True
BAHASA KADAZANDUSUN,BKD,6,5.0 Aspek Puralan Boros,5.3.2,Mongintutun om momoguno boros popoimagon id ayat.,5030200,True
BAHASA KADAZANDUSUN,BKD,6,5.0 Aspek Puralan Boros,5.3.3,Mongintutun om momoguno boros popiromut ngaran id ayat.,5030300,True
BAHASA KADAZANDUSUN,BKD,6,5.0 Aspek Puralan Boros,5.4.1,Mongintutun ayat di kinuludan AkSAK id pibarasan on ponuatan.,5040100,True
BAHASA KADAZANDUSUN,BKD,6,5.0 Aspek Puralan Boros,5.4.2,Momonsoi ayat di kinuludan ArSM id pibarasan on ponuatan.,5040200,True
BAHASA KADAZANDUSUN,BKD,6,5.0 Aspek Puralan Boros,5.4.3,Momonsoi ayat misompuru.,5040300,True
BAHASA KADAZANDUSUN,BKD,6,5.0 Aspek Puralan Boros,5.4.4,Momoguno tanda' basa' id ayat,5040400,True
BAHASA KADAZANDUSUN,BKD,6,5.0 Aspek Puralan Boros,5.5.1,Momogonop frasa miampai momoguno pomoroitan ginumu' di kotunud.,5050100,True
BAHASA KADAZANDUSUN,BKD,6,5.0 Aspek Puralan Boros,5.5.2,Momoguno pomoroitan ginumu' id ayat.,5050200,True
BAHASA KADAZANDUSUN,BKD,6,5.0 Aspek Puralan Boros,5.6.1,Momoguno tukadan di kotunud id ayat.,5060100,True
BAHASA KADAZANDUSUN,BKD,6,5.0 Aspek Puralan Boros,5.6.2,Popoindalan pibarasan montok popointalang rati' tukadan.,5060200,True
