subjectName,subjectId,year,groupName,spCode,spDescription,sortOrder,isActive
BAHASA KADAZANDUSUN,BKD,3,2.0 Kabaalan Mambasa',2.3.3,Momoguno koilaan id teks pambasaan montok; monimbar ponguhatan; popoindalan ponuhuan; monuhuk pokionuon,2030300,True
BAHASA KADAZANDUSUN,BKD,3,2.0 Kabaalan Mambasa',2.3.4,Popolombus ponguhatan montok mokianu kointalangan lobi kokomoi do teks di nabasa’.,2030400,True
BAHASA KADAZANDUSUN,BKD,3,2.0 Kabaalan Mambasa',2.4.1,Popointalang woyo' toluud id teks.,2040100,True
BAHASA KADAZANDUSUN,BKD,3,2.0 Kabaalan Mambasa',2.4.2,Papatayad boros di apangkal mantad ayat toi ko' teks.,2040200,True
BAHASA KADAZANDUSUN,BKD,3,2.0 Kabaalan Mambasa',2.4.3,Tumanud ponontudukan mongingia' montok manahang sorita' di nabasa',2040300,True
BAHASA KADAZANDUSUN,BKD,3,2.0 Kabaalan Mambasa',2.4.4,Momiadang koilaan di nabasa' miampai momoguno peta pomusarahan di kosudong.,2040400,True
BAHASA KADAZANDUSUN,BKD,3,3.0 Kabaalan Monuat,3.1.1,Monuat boros di; kivokal toniba'; kimora,3010100,True
BAHASA KADAZANDUSUN,BKD,3,3.0 Kabaalan Monuat,3.1.2,Monoriulud putul boros montok momonsoi boros kokomoi; Numbul (Ordinal); Pakalaja'an; Padsakayan; Pomoinan; Sipoot; Tuunion; Taakanon om tiinumon; Tanom; Tongosongongi'; Sikul; Tayam,3010200,True
BAHASA KADAZANDUSUN,BKD,3,3.0 Kabaalan Monuat,3.1.3,Monuat boros nosugkuan.,3010300,True
BAHASA KADAZANDUSUN,BKD,3,3.0 Kabaalan Monuat,3.1.4,Monuat boros di kipimato noolos; /c/; /f/; /q/; /x/,3010400,True
BAHASA KADAZANDUSUN,BKD,3,3.0 Kabaalan Monuat,3.1.6,Monuat boros momoguno ponuatan mirangkai,3010600,True
BAHASA KADAZANDUSUN,BKD,3,3.0 Kabaalan Monuat,3.2.1,Momonsoi boros mintootoiso miampai momoguno ija'an di kotunud.,3020100,True
BAHASA KADAZANDUSUN,BKD,3,3.0 Kabaalan Monuat,3.2.2,Momogonop ayat mantad boros di pinatahak.,3020200,True
BAHASA KADAZANDUSUN,BKD,3,3.0 Kabaalan Monuat,3.2.3,Momonsoi mogikaakawo ayat maya' ponguhupan do mongigia'.,3020300,True
BAHASA KADAZANDUSUN,BKD,3,3.0 Kabaalan Monuat,3.2.4,Monuat tanda' basa' di kotunud montok mogikaakawo ayat.,3020400,True
BAHASA KADAZANDUSUN,BKD,3,3.0 Kabaalan Monuat,3.2.5,Monuat frasa momoguno ponuatan mirangkai.,3020500,True
BAHASA KADAZANDUSUN,BKD,3,3.0 Kabaalan Monuat,3.3.1,Monuat tumanud format ponuatan montok isoiso' ponuatan; Surat; Rencana: naratif; Autobiografi,3030100,True
BAHASA KADAZANDUSUN,BKD,3,3.0 Kabaalan Monuat,3.3.2,Popisudong frasa toi ko' ayat montok momonsoi ponuatan disumiliu pangaan.,3030200,True
BAHASA KADAZANDUSUN,BKD,3,3.0 Kabaalan Monuat,3.3.3,Momonsoi ponuatan id pangaan maya' ponguhupan mongingia'.,3030300,True
BAHASA KADAZANDUSUN,BKD,3,3.0 Kabaalan Monuat,3.3.4,Mongoput sorita'.,3030400,True
BAHASA KADAZANDUSUN,BKD,3,4.0 Kabaalan Kolumison Boros,4.1.1,Popisuai koubasanan id koposion tinaru Kadazan om Dusun; Woyoo koposion; Kaadat-adato' & Pogilinan: kinolodion,4010100,True
BAHASA KADAZANDUSUN,BKD,3,4.0 Kabaalan Kolumison Boros,4.1.2,Monginonong sorita' tinaru di kipononsunudan.,4010200,True
BAHASA KADAZANDUSUN,BKD,3,4.0 Kabaalan Kolumison Boros,4.1.3,Momonsoi buuk tonini' kokomoi bontugan Kadazan om Dusun.,4010300,True
BAHASA KADAZANDUSUN,BKD,3,4.0 Kabaalan Kolumison Boros,4.1.4,Mongintutun tuunion tinaru.,4010400,True
BAHASA KADAZANDUSUN,BKD,3,4.0 Kabaalan Kolumison Boros,4.2.1,Minsingumbal popolombus; tangon; sundait; hiis; Hius; Andai,4020100,True
BAHASA KADAZANDUSUN,BKD,3,4.0 Kabaalan Kolumison Boros,4.2.2,Momonsoi poster sundait om sisimbar. Momonsoi kolaj montok popokito tangon di norongou toi ko' nabasa'.,4020200,True
BAHASA KADAZANDUSUN,BKD,3,4.0 Kabaalan Kolumison Boros,4.3.1,Mogihum koilaan om mogibooboros kokomoi toilaan sandad do tinaru; Pongindopuan; Teknologi,4030100,True
BAHASA KADAZANDUSUN,BKD,3,4.0 Kabaalan Kolumison Boros,4.3.2,Poposunud koilaan kokomoi toilaan sandad do tinaru maya' buuk tagayo.,4030200,True
BAHASA KADAZANDUSUN,BKD,3,4.0 Kabaalan Kolumison Boros,4.4.1,Monoriuk koilaan kokomoi; Pomoinan sandad; Tuunion koubasanan,4040100,True
BAHASA KADAZANDUSUN,BKD,3,4.0 Kabaalan Kolumison Boros,4.4.2,Minsingumbal; Mamain pomoinan sandad; Popouni tuunion koubasanan,4040200,True
BAHASA KADAZANDUSUN,BKD,3,4.0 Kabaalan Kolumison Boros,4.4.3,Momonsoi replika; Pomoinan sandad; Tuunion koubasanan,4040300,True
BAHASA KADAZANDUSUN,BKD,3,5.0 Aspek Puralan Boros,5.1.1,Popotunud ija'an montok boros di; kivokal toniba'; kimora; kipimato noolos,5010100,True
BAHASA KADAZANDUSUN,BKD,3,5.0 Aspek Puralan Boros,5.1.2,Mamarait boros di; kivokal toniba'; kimora; kipimato noolos,5010200,True
BAHASA KADAZANDUSUN,BKD,3,5.0 Aspek Puralan Boros,5.1.3,Mongija' boros montok boros nosugkuan.,5010300,True
BAHASA KADAZANDUSUN,BKD,3,5.0 Aspek Puralan Boros,5.2.1,Monompipi' boros tumanud sompuruan; Boros Ngaran; Boros Maan; Boros Ula,5020100,True
BAHASA KADAZANDUSUN,BKD,3,5.0 Aspek Puralan Boros,5.2.2,Momili' sompuruan boros di kotunud montok momogonop ayat.,5020200,True
BAHASA KADAZANDUSUN,BKD,3,5.0 Aspek Puralan Boros,5.3.1,Momonsoi boros kokomoi; Numbul (Ordinal); Pakalaja'an; Padsakayan; Pomoinan; Sipoot; Taakanon om tiinumon; Tanom; Tongosongongi'; Sikul; Tayam,5030100,True
BAHASA KADAZANDUSUN,BKD,3,5.0 Aspek Puralan Boros,5.3.2,Minsingumbal monugku boros.,5030200,True
BAHASA KADAZANDUSUN,BKD,3,5.0 Aspek Puralan Boros,5.4.1,Mongintutun ayat di kinuludan; MSOO; MSAk; MSAkT,5040100,True
BAHASA KADAZANDUSUN,BKD,3,5.0 Aspek Puralan Boros,5.4.2,Minsingumbal momonsoi ayat nuludan; MSOO; MSAk; MSAkT,5040200,True
BAHASA KADAZANDUSUN,BKD,3,5.0 Aspek Puralan Boros,5.4.3,Momoguno tanda' basa' di kotunud montok mogikaakawo ayat.,5040300,True
BAHASA KADAZANDUSUN,BKD,3,5.0 Aspek Puralan Boros,5.4.4,Momonsoi ayat; mintootoiso; misompuru,5040400,True
BAHASA KADAZANDUSUN,BKD,3,5.0 Aspek Puralan Boros,5.5.1,Mogibooboros montok papatantu' pomoroitan ginumu' di kotunud montok nunu i okito id bahan pongunsub.,5050100,True
BAHASA KADAZANDUSUN,BKD,3,5.0 Aspek Puralan Boros,5.5.2,Momogonop frasa miampai momoguno pomoroitan ginumu' di kotunud.,5050200,True
BAHASA KADAZANDUSUN,BKD,3,5.0 Aspek Puralan Boros,5.6.1,Momonsoi do ilustrasi montok popolombus rati' tukadan,5060100,True
BAHASA KADAZANDUSUN,BKD,3,5.0 Aspek Puralan Boros,5.6.2,Momoguno tukadan di kotunud id ayat.,5060200,True
BAHASA KADAZANDUSUN,BKD,4,1.0 Kabaalan Mokinongou Om Moboros,1.1.1,Mongilo pisuayan tuni pimato. Mora; Diftong; Songui,1010100,True
BAHASA KADAZANDUSUN,BKD,4,1.0 Kabaalan Mokinongou Om Moboros,1.1.2,Monoinu' pomoroitan boros. Mintootoiso; Nosugku; Misompuru; Misaup,1010200,True
BAHASA KADAZANDUSUN,BKD,4,1.0 Kabaalan Mokinongou Om Moboros,1.2.1,Popisuai kopolombusan do tuni pimato. Mora; Diftong; Songui 1,1020100,True
BAHASA KADAZANDUSUN,BKD,4,1.0 Kabaalan Mokinongou Om Moboros,1.2.2,Popolombus boros. Mintootoiso; Nosugku; Misompuru; Misaup,1020200,True
BAHASA KADAZANDUSUN,BKD,4,1.0 Kabaalan Mokinongou Om Moboros,1.2.3,Monoinu' pomoroitan boros kikonsonan. Sandad; Noolos,1020300,True
BAHASA KADAZANDUSUN,BKD,4,1.0 Kabaalan Mokinongou Om Moboros,1.3.1,Mokinongou montok popoindalan ponuhuan. 1,1030100,True
BAHASA KADAZANDUSUN,BKD,4,1.0 Kabaalan Mokinongou Om Moboros,1.3.2,Mokinongou montok monindu' kinootusan isoiso' ahal.,1030200,True
BAHASA KADAZANDUSUN,BKD,4,1.0 Kabaalan Mokinongou Om Moboros,1.3.3,Mokinongou montok maganu koilaan toponsol.,1030300,True
BAHASA KADAZANDUSUN,BKD,4,1.0 Kabaalan Mokinongou Om Moboros,1.3.4,Mokinongou montok maganu koilaan poinlisok.,1030400,True
BAHASA KADAZANDUSUN,BKD,4,1.0 Kabaalan Mokinongou Om Moboros,1.3.5,Mokinongou montok popisuai koilaan.,1030500,True
BAHASA KADAZANDUSUN,BKD,4,1.0 Kabaalan Mokinongou Om Moboros,1.3.6,Mokinongou montok mongintutun woyo' toluud id teks,1030600,True
BAHASA KADAZANDUSUN,BKD,4,1.0 Kabaalan Mokinongou Om Moboros,1.4.1,Monoinu' om popoboros koilaan toponsol mantad bahan pongunsub.,1040100,True
BAHASA KADAZANDUSUN,BKD,4,1.0 Kabaalan Mokinongou Om Moboros,1.4.2,Popointalang koilaan di notimung.,1040200,True
BAHASA KADAZANDUSUN,BKD,4,1.0 Kabaalan Mokinongou Om Moboros,1.4.3,Popoilo ponuhuan di norongou.,1040300,True
BAHASA KADAZANDUSUN,BKD,4,1.0 Kabaalan Mokinongou Om Moboros,1.4.4,Popotolinahas kointalangan.,1040400,True
BAHASA KADAZANDUSUN,BKD,4,1.0 Kabaalan Mokinongou Om Moboros,1.4.5,Minsingkono' montok popolombus do topurimanan.,1040500,True
BAHASA KADAZANDUSUN,BKD,4,1.0 Kabaalan Mokinongou Om Moboros,1.5.1,Popolombus mogikaakawo ayat miampai momoguno do loyuk di kotunud.,1050100,True
BAHASA KADAZANDUSUN,BKD,4,1.0 Kabaalan Mokinongou Om Moboros,1.5.2,Popolombus piumpangalan di olinuud.,1050200,True
BAHASA KADAZANDUSUN,BKD,4,1.0 Kabaalan Mokinongou Om Moboros,1.5.3,Popolombus mogikaakawo teks maya' lisan:,1050300,True
BAHASA KADAZANDUSUN,BKD,4,2.0 Kabaalan Mambasa',2.1.1,Mongilo kopolombusan pimato di noguno id isoiso’ boros. Mora; Diftong; Songui,2010100,True
BAHASA KADAZANDUSUN,BKD,4,2.0 Kabaalan Mambasa',2.1.2,Monoinu' ija'an om kopolombusan do boros.,2010200,True
BAHASA KADAZANDUSUN,BKD,4,2.0 Kabaalan Mambasa',2.1.3,Monginomot pamansayan montok mogikaakawo boros.,2010300,True
BAHASA KADAZANDUSUN,BKD,4,2.0 Kabaalan Mambasa',2.1.4,Monoinu' pomogunaan do tanda' basa' di kotunud montok mogikaakawo ayat.,2010400,True
BAHASA KADAZANDUSUN,BKD,4,2.0 Kabaalan Mambasa',2.2.1,Mamarait isoiso' boros momoguno loyuk di kotunud. Boros kimora; Boros kidiftong; Boros kipimato songui,2020100,True
BAHASA KADAZANDUSUN,BKD,4,2.0 Kabaalan Mambasa',2.2.2,Mongija' om popoboros mogikaakawo boros. Mintootoiso; Nosugku; Misompuru; Misaup,2020200,True
BAHASA KADAZANDUSUN,BKD,4,2.0 Kabaalan Mambasa',2.2.3,Popolombus boros di kipimato; sandad; noolos,2020300,True
BAHASA KADAZANDUSUN,BKD,4,2.0 Kabaalan Mambasa',2.2.4,Popolombus momoguno ohou di otolinahas om loyuk di kotunud montok mogikaakawo ayat om teks. ayat toomod; ayat pongudio; ayat ponuhuan; ayat kotigagan,2020400,True
BAHASA KADAZANDUSUN,BKD,4,2.0 Kabaalan Mambasa',2.2.5,Mambasa' opuhod miampai momoguno intonasi om loyuk di kotunud montok mogikaakawo teks.,2020500,True
BAHASA KADAZANDUSUN,BKD,4,2.0 Kabaalan Mambasa',2.3.1,Mangarati' om monompipi' koilaan di nabasa'.,2030100,True
BAHASA KADAZANDUSUN,BKD,4,2.0 Kabaalan Mambasa',2.3.2,Mongompuri koilaan di nabasa'.,2030200,True
BAHASA KADAZANDUSUN,BKD,4,2.0 Kabaalan Mambasa',2.3.3,Mongulud koilaan tumanud nuludan sorita' id teks.,2030300,True
BAHASA KADAZANDUSUN,BKD,4,2.0 Kabaalan Mambasa',2.3.4,Momiadang kowoowoyoo watak id susuyan.,2030400,True
BAHASA KADAZANDUSUN,BKD,4,2.0 Kabaalan Mambasa',2.4.1,Monompipi' boros mantad teks pambasaan. Boros kimora; Boros kidiftong; Boros kipimato songui,2040100,True
BAHASA KADAZANDUSUN,BKD,4,2.0 Kabaalan Mambasa',2.4.2,Monindu' komoyon boros tumanud bahan pongunsub.,2040200,True
BAHASA KADAZANDUSUN,BKD,4,2.0 Kabaalan Mambasa',2.4.3,Poposunud woyo' toluud mantad teks toi ko' bahan pongunsub.,2040300,True
BAHASA KADAZANDUSUN,BKD,4,2.0 Kabaalan Mambasa',2.4.4,Popointalang koilaan toponsol id teks pambasaan toi ko' bahan pongunsub.,2040400,True
BAHASA KADAZANDUSUN,BKD,4,2.0 Kabaalan Mambasa',2.4.5,Popoundaliu koilaan mantad linear kumaa id okon linear.,2040500,True
BAHASA KADAZANDUSUN,BKD,4,3.0 Kabaalan Monuat,3.1.1,Monuat boros di kiwaa; mora; diftong; songui,3010100,True
BAHASA KADAZANDUSUN,BKD,4,3.0 Kabaalan Monuat,3.1.2,Monuat boros miampai momoguno ija'an di kotunud. Mintootoiso; Nosugkuan; Misompuru; Misaup,3010200,True
BAHASA KADAZANDUSUN,BKD,4,3.0 Kabaalan Monuat,3.1.3,Monuat boros tumanud bahan pongunsub di pinatahak.,3010300,True
BAHASA KADAZANDUSUN,BKD,4,3.0 Kabaalan Monuat,3.1.4,Monuat boros di kipimato; sandad; noolos,3010400,True
BAHASA KADAZANDUSUN,BKD,4,3.0 Kabaalan Monuat,3.2.1,Mongulud boros sumiliu frasa tumanud bahan pongunsub.,3020100,True
BAHASA KADAZANDUSUN,BKD,4,3.0 Kabaalan Monuat,3.2.2,Mongulud frasa toi ko' ayat tumanud bahan pongunsub.,3020200,True
BAHASA KADAZANDUSUN,BKD,4,3.0 Kabaalan Monuat,3.2.3,Momonsoi ayat mantad boros di pinatahak.,3020300,True
BAHASA KADAZANDUSUN,BKD,4,3.0 Kabaalan Monuat,3.2.4,Monuat kawagu ayat miampai momoguno tanda' basa' di kotunud.,3020400,True
BAHASA KADAZANDUSUN,BKD,4,3.0 Kabaalan Monuat,3.2.5,Momonsoi do frasa om ayat di ouhai tumanud bahan pongunsub.,3020500,True
BAHASA KADAZANDUSUN,BKD,4,3.0 Kabaalan Monuat,3.3.1,Papatandan tonsi toponsol montok isoiso' ponuatan.,3030100,True
BAHASA KADAZANDUSUN,BKD,4,3.0 Kabaalan Monuat,3.3.2,Monguyad tonsi ponokodung montok momogonop sorita'.,3030200,True
BAHASA KADAZANDUSUN,BKD,4,3.0 Kabaalan Monuat,3.3.3,Momonsoi ponuatan di momoguno format om ayat di ouluud om agramatis. Kopoilaan; Rencana:Kobolingkangan om ponolibamban; Tangon; Abal; Ponuhuan; Pibarasan; monguhot abal; magalap; monorimo/ au' monorimo pagalapan; Suai po,3030300,True
BAHASA KADAZANDUSUN,BKD,4,4.0 Kabaalan Kolumison Boros,4.1.1,Mongintutun sipoot koubasanan tinaru.,4010100,True
BAHASA KADAZANDUSUN,BKD,4,4.0 Kabaalan Kolumison Boros,4.1.2,Momonsoi buuk skrap montok popokito koilaan kokomoi tungkus kointutunan tinaru Kadazan om Dusun; Pogoduhan id koposion tikid tadau; Bobolian,4010200,True
BAHASA KADAZANDUSUN,BKD,4,4.0 Kabaalan Kolumison Boros,4.1.3,Monginonong tangon tinaru.,4010300,True
BAHASA KADAZANDUSUN,BKD,4,4.0 Kabaalan Kolumison Boros,4.1.4,Momonsoi poster montok popointutun susumangod mantad tinaru Kadazan om Dusun.,4010400,True
BAHASA KADAZANDUSUN,BKD,4,4.0 Kabaalan Kolumison Boros,4.2.1,Mongilo om momoguno loyuk di kotunud montok popolombus do; tangon; sundait; hiis; Tinggono; Sisindiron,4020100,True
BAHASA KADAZANDUSUN,BKD,4,4.0 Kabaalan Kolumison Boros,4.2.2,Momonsoi; Hiis; Sundait,4020200,True
BAHASA KADAZANDUSUN,BKD,4,4.0 Kabaalan Kolumison Boros,4.2.3,Momonsoi kolaj montok poposunud koilaan id; tangon; sundait; hiis,4020300,True
BAHASA KADAZANDUSUN,BKD,4,4.0 Kabaalan Kolumison Boros,4.3.1,Papapanau ponurubungan montok mongintutun toilaan sandad tinaru kokomoi; Motif om sorindak sandad tinaru'; Pomutanaman sandad,4030100,True
BAHASA KADAZANDUSUN,BKD,4,4.0 Kabaalan Kolumison Boros,4.3.2,Mogibooboros montok popionit koilaan di notimung mantad ponurubungan.,4030200,True
BAHASA KADAZANDUSUN,BKD,4,4.0 Kabaalan Kolumison Boros,4.4.1,Monoriuk koilaan kokomoi; Tinunturu' sandad; Bakaang Pomutanaman sandad,4040100,True
BAHASA KADAZANDUSUN,BKD,4,4.0 Kabaalan Kolumison Boros,4.4.2,Minsingumbal; momolukis motif om sorindak tinaru; mamain sipoot sandad,4040200,True
BAHASA KADAZANDUSUN,BKD,4,4.0 Kabaalan Kolumison Boros,4.4.3,Momonsoi replika; Bakaang Pomutanaman; Tinunturu',4040300,True
BAHASA KADAZANDUSUN,BKD,4,5.0 Aspek Puralan Boros,5.1.1,Momoguno pimato di kotunud id ponuatan.,5010100,True
BAHASA KADAZANDUSUN,BKD,4,5.0 Aspek Puralan Boros,5.1.2,Momoguno boros di kipimato / ' / id lisan om ponuatan.,5010200,True
BAHASA KADAZANDUSUN,BKD,4,5.0 Aspek Puralan Boros,5.1.3,Momoguno boros di,5010300,True
BAHASA KADAZANDUSUN,BKD,4,5.0 Aspek Puralan Boros,5.2.1,Momoguno do Boros Ngaran id ayat,5020100,True
BAHASA KADAZANDUSUN,BKD,4,5.0 Aspek Puralan Boros,5.2.2,Momoguno do Boros Maan id ayat.,5020200,True
BAHASA KADAZANDUSUN,BKD,4,5.0 Aspek Puralan Boros,5.2.3,Momoguno do Boros Ula id ayat.,5020300,True
BAHASA KADAZANDUSUN,BKD,4,5.0 Aspek Puralan Boros,5.3.1,Mongintutun om momoguno boros popionit id ayat.,5030100,True
BAHASA KADAZANDUSUN,BKD,4,5.0 Aspek Puralan Boros,5.3.2,Mongintutun om momoguno partikol id ayat.,5030200,True
BAHASA KADAZANDUSUN,BKD,4,5.0 Aspek Puralan Boros,5.3.3,Mongintutun om momoguno boros toguangon id ayat.,5030300,True
BAHASA KADAZANDUSUN,BKD,4,5.0 Aspek Puralan Boros,5.4.1,Mongintutun ayat di kinuludan; Maan + Subjek + Objek Maan; Maan + Subjek + Adjektif Kinoyonon; Maan + Subjek + Adjektif Kinoyonon + Objek,5040100,True
BAHASA KADAZANDUSUN,BKD,4,5.0 Aspek Puralan Boros,5.4.2,Momonsoi ayat mintootoiso.,5040200,True
BAHASA KADAZANDUSUN,BKD,4,5.0 Aspek Puralan Boros,5.4.3,Momonsoi ayat misompuru.,5040300,True
BAHASA KADAZANDUSUN,BKD,4,5.0 Aspek Puralan Boros,5.4.4,Momoguno tanda' basa' id ayat.,5040400,True
BAHASA KADAZANDUSUN,BKD,4,5.0 Aspek Puralan Boros,5.5.1,Momogonop frasa miampai momoguno pomoroitan ginumu' di kotunud.,5050100,True
BAHASA KADAZANDUSUN,BKD,4,5.0 Aspek Puralan Boros,5.5.2,Momoguno pomoroitan ginumu' id ayat.,5050200,True
BAHASA KADAZANDUSUN,BKD,4,5.0 Aspek Puralan Boros,5.6.1,Momoguno tukadan di kotunud id ayat.,5060100,True
BAHASA KADAZANDUSUN,BKD,4,5.0 Aspek Puralan Boros,5.6.2,Popoindalan pibarasan montok popointalang rati' tukadan.,5060200,True
BAHASA KADAZANDUSUN,BKD,5,1.0 Kabaalan Mokinongou Om Momboros,1.1.1,Kaanu popisuai om momungaran do tuni di norongou.,1010100,True
BAHASA KADAZANDUSUN,BKD,5,1.0 Kabaalan Mokinongou Om Momboros,1.1.2,Kaanu monguyad do koilaan kokomoi tuni di norongou.,1010200,True
BAHASA KADAZANDUSUN,BKD,5,1.0 Kabaalan Mokinongou Om Momboros,1.1.3,Kaanu mongusui tumanud loyuk do kobooboroso' di norongou.,1010300,True
BAHASA KADAZANDUSUN,BKD,5,1.0 Kabaalan Mokinongou Om Momboros,1.2.2,Kaanu monompipi' om popoboros boros di kivokal tanaru om toniba'.,1020200,True
BAHASA KADAZANDUSUN,BKD,5,1.0 Kabaalan Mokinongou Om Momboros,1.2.3,Kaanu monompipi' om mamarait boros di kipimato konsonan noolos.,1020300,True
BAHASA KADAZANDUSUN,BKD,5,1.0 Kabaalan Mokinongou Om Momboros,1.2.4,Kaanu monindu' om mamarait boros kisigot.,1020400,True
BAHASA KADAZANDUSUN,BKD,5,1.0 Kabaalan Mokinongou Om Momboros,1.2.5,Kaanu monindu' om mamarait boros kituni / b / om / b /.,1020500,True
BAHASA KADAZANDUSUN,BKD,5,1.0 Kabaalan Mokinongou Om Momboros,1.2.6,Kaanu monindu' om mamarait boros kituni / d / om / d /.,1020600,True
BAHASA KADAZANDUSUN,BKD,5,1.0 Kabaalan Mokinongou Om Momboros,1.3.1,Kaanu mokinongou pomoroitan om loyuk di kotunud montok momohulit boros.,1030100,True
BAHASA KADAZANDUSUN,BKD,5,1.0 Kabaalan Mokinongou Om Momboros,1.3.2,Kaanu mokinongou montok Popolombus mogikaakawo ayat,1030200,True
BAHASA KADAZANDUSUN,BKD,5,1.0 Kabaalan Mokinongou Om Momboros,1.3.3,Kaanu mokinongou montok popolombus pibarasan toi ko' booboroson.,1030300,True
BAHASA KADAZANDUSUN,BKD,5,1.0 Kabaalan Mokinongou Om Momboros,1.4.1,Kaanu mokinongou montok maganu koilaan.,1040100,True
BAHASA KADAZANDUSUN,BKD,5,1.0 Kabaalan Mokinongou Om Momboros,1.4.2,Kaanu mogibooboros montok Momiadang koilaan di norongou,1040200,True
BAHASA KADAZANDUSUN,BKD,5,1.0 Kabaalan Mokinongou Om Momboros,1.4.3,Kaanu momoguno koilaan di Norongou montok mogisuusai kohuboyoon.,1040300,True
BAHASA KADAZANDUSUN,BKD,5,1.0 Kabaalan Mokinongou Om Momboros,1.4.4,Kaanu manahang koilaan di norongou.,1040400,True
BAHASA KADAZANDUSUN,BKD,5,1.0 Kabaalan Mokinongou Om Momboros,1.4.5,Kaanu monimbar om monguyad isoiso' ponguhatan.,1040500,True
BAHASA KADAZANDUSUN,BKD,5,1.0 Kabaalan Mokinongou Om Momboros,1.4.6,Kaanu mokinongou om popoindalan do Isoiso' ponuhuan toi ko' pokionuon.,1040600,True
BAHASA KADAZANDUSUN,BKD,5,1.0 Kabaalan Mokinongou Om Momboros,1.4.7,Kaanu monolibamban isoiso' kobolingkangan di norongou.,1040700,True
BAHASA KADAZANDUSUN,BKD,5,1.0 Kabaalan Mokinongou Om Momboros,1.5.1,Kaanu mongulud boros montok popolombus ayat di kotunud om olinuud id pibarasan toi ko' id booboroson.,1050100,True
BAHASA KADAZANDUSUN,BKD,5,1.0 Kabaalan Mokinongou Om Momboros,1.5.2,Kaanu popolombus ayat di kotunud om olinuud id mongisuusuai kohuboyoon.,1050200,True
BAHASA KADAZANDUSUN,BKD,5,1.0 Kabaalan Mokinongou Om Momboros,1.5.3,Kaanu momoguno piipiro boros Pomolohou di kosudong id pibarasan toi ko' id booboroson.,1050300,True
BAHASA KADAZANDUSUN,BKD,5,1.0 Kabaalan Mokinongou Om Momboros,1.5.4,Kaanu momoguno boros om ayat di olinuud id pitimbungakan.,1050400,True
BAHASA KADAZANDUSUN,BKD,5,1.0 Kabaalan Mokinongou Om Momboros,1.5.5,Kaanu momoguno boros om ayat di kotunud om olinuud montok mokianu kointalangan.,1050500,True
BAHASA KADAZANDUSUN,BKD,5,1.0 Kabaalan Mokinongou Om Momboros,1.5.6,Kaanu popolombus ponguhatan miampai momoguno boros om ayat di kotunud om olinuud.,1050600,True
BAHASA KADAZANDUSUN,BKD,5,1.0 Kabaalan Mokinongou Om Momboros,1.6.1,Kaanu poposunud do ahal sondii' miampai momoguno boros om ayat di olinuud.,1060100,True
BAHASA KADAZANDUSUN,BKD,5,1.0 Kabaalan Mokinongou Om Momboros,1.6.2,Kaanu monusui do sorita' toi ko' susuyan tumanud nuludan.,1060200,True
BAHASA KADAZANDUSUN,BKD,5,1.0 Kabaalan Mokinongou Om Momboros,1.6.3,Kaanu mongusui watak montok popolombus do topurimanan.,1060300,True
BAHASA KADAZANDUSUN,BKD,5,1.0 Kabaalan Mokinongou Om Momboros,1.6.4,Kaanu poposogu' pomusarahan kokomoi bahan pongunsub di pinatahak.,1060400,True
BAHASA KADAZANDUSUN,BKD,5,1.0 Kabaalan Mokinongou Om Momboros,1.6.5,Kaanu poposuul pomusarahan id pitimbungakan.,1060500,True
BAHASA KADAZANDUSUN,BKD,5,2.0 Kabaalan Mambasa',2.1.1,Kaanu popolombus boros tumanud ija'an montok boros di; kivokal tanaru om toniba'; kisigot; kikonsonan / b / om / d /,2010100,True
BAHASA KADAZANDUSUN,BKD,5,2.0 Kabaalan Mambasa',2.1.2,Kaanu popolombus boros tumanud otus om loyuk montok boros; mintootoiso; nosugku; misompuru; misaup,2010200,True
BAHASA KADAZANDUSUN,BKD,5,2.0 Kabaalan Mambasa',2.2.3,Kaanu mambasa' mogikaakawo ayat momoguno loyuk om otus d pointunud.,2020300,True
BAHASA KADAZANDUSUN,BKD,5,2.0 Kabaalan Mambasa',2.3.1,Kaanu mambasa' do alantas.,2030100,True
BAHASA KADAZANDUSUN,BKD,5,2.0 Kabaalan Mambasa',2.3.2,Kaanu mambasa' mogikaakawo Teks tumanud loyuk di kotunud.,2030200,True
BAHASA KADAZANDUSUN,BKD,5,2.0 Kabaalan Mambasa',2.4.1,Kaanu popisudong komoyon boros.,2040100,True
BAHASA KADAZANDUSUN,BKD,5,2.0 Kabaalan Mambasa',2.4.2,Kaanu mongilo piipiro sokomoyon do iso' boros.,2040200,True
BAHASA KADAZANDUSUN,BKD,5,2.0 Kabaalan Mambasa',2.4.3,Kaanu momoguno do komoiboros Montok popoinggumu' tinimungan boros.,2040300,True
BAHASA KADAZANDUSUN,BKD,5,2.0 Kabaalan Mambasa',2.5.1,Kaanu maganu koilaan mantad teks.,2050100,True
BAHASA KADAZANDUSUN,BKD,5,2.0 Kabaalan Mambasa',2.5.2,Kaanu momiadang koilaan di nabasa'.,2050200,True
BAHASA KADAZANDUSUN,BKD,5,2.0 Kabaalan Mambasa',2.5.3,Kaanu mongulud om popoboros koilaan di nabasa'.,2050300,True
BAHASA KADAZANDUSUN,BKD,5,2.0 Kabaalan Mambasa',2.5.4,Kaanu momoguno koilaan montok Monimbar ponguhatan.,2050400,True
BAHASA KADAZANDUSUN,BKD,5,2.0 Kabaalan Mambasa',2.6.1,Kaanu momoguno peta pomusarahan di kosudong montok popokito koilaan di notimung mantad bahan di nabasa’.,2060100,True
BAHASA KADAZANDUSUN,BKD,5,2.0 Kabaalan Mambasa',2.6.2,Kaanu popoundaliu koilaan mantad grafik kumaa id linear.,2060200,True
BAHASA KADAZANDUSUN,BKD,5,2.0 Kabaalan Mambasa',2.7.1,Kaanu manahak pounayan kokomoi Koilaan di nabasa'.,2070100,True
BAHASA KADAZANDUSUN,BKD,5,2.0 Kabaalan Mambasa',2.7.2,Kaanu manahak kritik toi ko' monokodung do watak id teks di nabasa'.,2070200,True
BAHASA KADAZANDUSUN,BKD,5,3.0 Kabaalan Monuat,3.1.5,Kaanu monuat frasa om ayat id ponuatan toomod om mirangkai.,3010500,True
BAHASA KADAZANDUSUN,BKD,5,3.0 Kabaalan Monuat,3.2.1,Kaanu monuat boros numbul.,3020100,True
BAHASA KADAZANDUSUN,BKD,5,3.0 Kabaalan Monuat,3.2.2,Kaanu momonsoi mogikaakawo boros.,3020200,True
BAHASA KADAZANDUSUN,BKD,5,3.0 Kabaalan Monuat,3.2.3,Kaanu momonsoi om monuat boros tumanud bahan pongunsub di pinatahak.,3020300,True
BAHASA KADAZANDUSUN,BKD,5,3.0 Kabaalan Monuat,3.3.1,Kaanu momili' boros montok Momogonop frasa toi ko' ayat.,3030100,True
BAHASA KADAZANDUSUN,BKD,5,3.0 Kabaalan Monuat,3.3.2,Kaanu mongulud ayat tumanud bahan pongunsub montok momonsoi pangaan.,3030200,True
BAHASA KADAZANDUSUN,BKD,5,3.0 Kabaalan Monuat,3.3.3,Kaanu momonsoi mogikaakawo ayat di agramatis tumanud bahan pongunsub.,3030300,True
BAHASA KADAZANDUSUN,BKD,5,3.0 Kabaalan Monuat,3.3.4,Kaanu monuat ayat id pangaan miampai momoguno ayat di agramatis.,3030400,True
BAHASA KADAZANDUSUN,BKD,5,3.0 Kabaalan Monuat,3.4.1,Kaanu mongintutun format ponuatan di kotunud.,3040100,True
BAHASA KADAZANDUSUN,BKD,5,3.0 Kabaalan Monuat,3.4.2,Kaanu monimung koilaan momoguno mogikaakawo peta pomusarahan,3040200,True
BAHASA KADAZANDUSUN,BKD,5,3.0 Kabaalan Monuat,3.4.3,Kaanu mongulud om monuat tonsi toponsol montok isoiso' ponuatan.,3040300,True
BAHASA KADAZANDUSUN,BKD,5,3.0 Kabaalan Monuat,3.4.4,Kaanu monguyad tonsi.,3040400,True
BAHASA KADAZANDUSUN,BKD,5,3.0 Kabaalan Monuat,3.4.5,Kaanu monupu ponuatan tumanud format di kotunud.,3040500,True
BAHASA KADAZANDUSUN,BKD,5,3.0 Kabaalan Monuat,3.5.1,Kaanu mongulud ayat montok monupu' sorita'.,3050100,True
BAHASA KADAZANDUSUN,BKD,5,3.0 Kabaalan Monuat,3.5.2,Kaanu momogonop ayat montok monupu' sorita'. Kaanu momonsoi ayat montok monupu' sorita' tumanud bahan pongunsub.,3050200,True
BAHASA KADAZANDUSUN,BKD,5,3.0 Kabaalan Monuat,3.5.3,Kaanu monguyad tonsi montok monupu' sorita'.,3050300,True
BAHASA KADAZANDUSUN,BKD,5,3.0 Kabaalan Monuat,3.5.5,Kaanu monuat sorita' id pangaan toniba'.,3050500,True
BAHASA KADAZANDUSUN,BKD,5,4.0 Kabaalan Kolumison Boros,4.1.1,"Kaanu momonsoi do folio, buuk skrap, kolaj, tinunturu', lukisan om suai po montok popokito do koilaan di notimung.",4010100,True
BAHASA KADAZANDUSUN,BKD,5,4.0 Kabaalan Kolumison Boros,4.1.2,"Kaanu popokito do koilaan di notimung maya' aktiviti manangon, suminding, minsingkono', sumayau om popolombus do hiis koubasanan.",4010200,True
BAHASA KADAZANDUSUN,BKD,5,4.0 Kabaalan Kolumison Boros,4.1.3,Kaanu papabanta asil di notimung.,4010300,True
BAHASA KADAZANDUSUN,BKD,5,4.0 Kabaalan Kolumison Boros,4.2.1,Kaanu monimung koilaan kokomoi tungkus koubasanan do tinaru Kadazan om Dusun.,4020100,True
BAHASA KADAZANDUSUN,BKD,5,4.0 Kabaalan Kolumison Boros,4.2.3,Kaanu manahak demonstrasi kokomoi tungkus koubasanan tinaru Kadazan om Dusun.,4020300,True
BAHASA KADAZANDUSUN,BKD,5,4.0 Kabaalan Kolumison Boros,4.2.4,Kaanu papapanau do ponoriukan montok mongilo tungkus koubasanan tinaru Kadazan om Dusun.,4020400,True
BAHASA KADAZANDUSUN,BKD,5,4.0 Kabaalan Kolumison Boros,4.2.5,Kaanu manahang om momiadang koilaan di notimung.,4020500,True
BAHASA KADAZANDUSUN,BKD,5,4.0 Kabaalan Kolumison Boros,4.2.6,Kaanu papabanta asil kalaja' di nowonsoi.,4020600,True
BAHASA KADAZANDUSUN,BKD,5,5.0 Kabaalan Puralan Boros,5.1.1,Kaanu popouni do tuni sigot soira' popolombus do boros.,5010100,True
